{
  "$schema": "../schemas/skill-deterministic-contract.schema.json",
  "contract_format_version": 1,
  "kind": "skill_design_contract",
  "name": "ceratops_skill_deterministic_contract",
  "captured_on": "2026-07-31",
  "source_files": [
    {
      "path": "$CERATOPS_AI_AGENTS_KIT_ROOT/skills/ceratops-skill-lifecycle/references/contracts/skill-contract-source-docs.json",
      "lines": "source-doc registry, skill standards, and installed skill references"
    },
    {
      "path": "$CERATOPS_AI_AGENTS_KIT_ROOT/skills/ceratops-skill-lifecycle/scripts/skills-consistency-source-validator.py",
      "lines": "deterministic skill source, metadata, runtime, contract, and portability checks"
    },
    {
      "path": "$CERATOPS_AI_AGENTS_KIT_ROOT/skills/ceratops-skill-lifecycle/scripts/runtime/install-managed-skills.py",
      "lines": "affected-set classification, direct-manifest inventory, and one transactional builder invocation"
    },
    {
      "path": "$CERATOPS_AI_AGENTS_KIT_ROOT/skills/ceratops-skill-lifecycle/scripts/fast-change.py",
      "lines": "classified direct-release patch, declared Markdown lint, exact tests, installation, commit, and compensation"
    },
    {
      "path": "$CERATOPS_AI_AGENTS_KIT_ROOT/skills/ceratops-skill-lifecycle/scripts/runtime/managed_runtime_builder.py",
      "lines": "selected-batch staging, activation, rollback, locking, ownership, and stale cleanup"
    },
    {
      "path": "$CERATOPS_AI_AGENTS_KIT_ROOT/scripts/deploy-skills.py",
      "lines": "versioned independent skill installer"
    },
    {
      "path": "$CERATOPS_AI_AGENTS_KIT_ROOT/skills/skill-sections.json",
      "lines": "shared section and runtime payload ownership"
    },
    {
      "path": "$CERATOPS_AI_AGENTS_KIT_ROOT/AGENTS.md",
      "lines": "skill maintenance and source-of-truth rules"
    }
  ],
  "parameters": {
    "skill_name": {
      "type": "string",
      "required": true
    },
    "skill_dir": {
      "type": "string",
      "required": false,
      "default_from": "skills/${skill_name}"
    },
    "validation_mode": {
      "type": "string",
      "required": false,
      "default": "full",
      "allowed": [
        "skill",
        "sections",
        "full"
      ]
    }
  },
  "required_scopes": [
    "skill"
  ],
  "source_docs_ref": "skill-contract-source-docs.json",
  "source_doc_scopes": [
    "skill"
  ],
  "non_deterministic_review_file": "skill-nondeterministic-contract.json",
  "remediation_policy": {
    "default": "report_only",
    "apply_flag": null,
    "auto_apply_check_ids": [],
    "ai_agent_check_ids": [
      "skill.repository_identity_and_profile",
      "skill.bootstrap_version_consistency",
      "skill.frontmatter_and_layout",
      "skill.metadata_alignment",
      "skill.runtime_payload_portability",
      "skill.runtime_source_ownership",
      "skill.shared_section_generation",
      "skill.multi_action_contract",
      "skill.resource_layout",
      "skill.public_doc_alignment",
      "skill.private_path_and_secret_absence",
      "skill.contract_reference_alignment",
      "skill.governance_consistency_audit"
    ],
    "destructive_or_irreversible": "always_report_only"
  },
  "execution": {
    "source_validator": "skills/ceratops-skill-lifecycle/scripts/skills-consistency-source-validator.py",
    "skill_validation_command": "python skills/ceratops-skill-lifecycle/scripts/skills-consistency-source-validator.py --mode skill --skill <skill-name>",
    "full_validation_command": "python skills/ceratops-skill-lifecycle/scripts/skills-consistency-source-validator.py --mode full",
    "section_validation_command": "python skills/ceratops-skill-lifecycle/scripts/skills-consistency-source-validator.py --mode sections",
    "runtime_inventory_command": "python skills/ceratops-skill-lifecycle/scripts/runtime/install-managed-skills.py --inventory-output <caller-selected-file>",
    "result_contract": "Source validation emits compact mode results; installation emits OK on payload-free success or one structured phase, skill, rollback, and reason blocker; inventory writes valid routing entries and malformed direct-manifest blockers to the caller-selected file and emits OK."
  },
  "checks": [
    {
      "id": "skill.repository_identity_and_profile",
      "category": "runtime",
      "deterministic_evidence": [
        "skills/skill-sections.json runtime_source_id",
        "skills/skill-sections.json validation_profile"
      ],
      "pass_condition": "The source manifest declares a nonempty stable runtime_source_id and either the ceratops or ceratops-compatible validation profile; full validation always applies common checks and only the ceratops profile adds Ceratops-specific icon, contract, retired-artifact, and repository-governance checks."
    },
    {
      "id": "skill.bootstrap_version_consistency",
      "category": "runtime",
      "deterministic_evidence": [
        "scripts/deploy-skills.py INSTALLER_VERSION",
        "bootstrap installer CLI behavior tests"
      ],
      "pass_condition": "A skill-bearing source repository bootstrap declares one positive internal INSTALLER_VERSION. The bootstrap is standard-library-only, renders selected skills and overlays their files without content validation, retirement, or lifecycle runtime calls, retains destination-only files and other skills, exposes only repo-root, install-root, and skill inputs, preserves input parsing and path safety, and cleans only bootstrap-owned staging and locks. Copy failures may leave partial updates. Managed runtime CLI and manifests contain no installer-version field."
    },
    {
      "id": "skill.frontmatter_and_layout",
      "category": "source",
      "deterministic_evidence": [
        "skill directory name",
        "source SKILL.md frontmatter",
        "source SKILL.md section and subsection structure"
      ],
      "pass_condition": "Source skill frontmatter contains only name and description; name matches the directory, contains 1 to 64 lowercase ASCII letters, digits, or hyphens, does not start or end with a hyphen, and contains no consecutive hyphens; description contains 40 to 1024 characters; the body contains a Markdown H2 section structure; the ceratops profile additionally requires Boundaries and Output Contract subsections."
    },
    {
      "id": "skill.metadata_alignment",
      "category": "metadata",
      "deterministic_evidence": [
        "skills/<skill-name>/agents/openai.yaml",
        "skills/ceratops-skill-lifecycle/references/templates/ceratops-logo-500.png",
        "source SKILL.md description"
      ],
      "pass_condition": "OpenAI interface metadata exists, default_prompt names the skill, display name resembles the skill identity, and short description contains 25 to 64 characters and overlaps the trigger description; the ceratops profile additionally requires icon fields, shared Ceratops icon paths, and matching bytes."
    },
    {
      "id": "skill.shared_section_generation",
      "category": "runtime",
      "deterministic_evidence": [
        "skills/skill-sections.json",
        "skills/sections/*",
        "source SKILL.md",
        "source action references",
        "managed and standalone installation behavior tests"
      ],
      "pass_condition": "Every source skill has a manifest assignment including core. Optional actions maps skill names to uniquely routed direct references/*.md action paths and nonempty section-ID lists; missing skills, unknown sections, unsafe paths, non-action targets, repeated sections, inherited skill sections, and generated markers in source actions are rejected. Skill-level assignments and canonical shared-section inputs are preserved. Each action's ordered shared content is inserted exactly once after its H1 only in installed copies, consistently across managed and independent installers. Source SKILL.md and action files remain delta-only. A repository with no source skills has empty skill, action, and canonical-section maps."
    },
    {
      "id": "skill.multi_action_contract",
      "category": "source",
      "deterministic_evidence": [
        "skills/skill-sections.json multi-action-skill assignments",
        "skills/<skill-name>/SKILL.md Action References",
        "skills/<skill-name>/references/*.md action titles"
      ],
      "pass_condition": "Every skill assigned the multi-action-skill section has one complete Action References index with at least two unique direct references/*.md paths; every mapped file exists and uses an Action title, and every top-level reference with an Action title is indexed."
    },
    {
      "id": "skill.resource_layout",
      "category": "source",
      "deterministic_evidence": [
        "skill top-level files and directories",
        "skills/<skill-name>/references/"
      ],
      "pass_condition": "Each skill folder contains `SKILL.md` and may contain `README.md` as its only top-level files and uses only profile-supported resource directories; the compatible profile may include `tests/`, while the ceratops profile allows `agents/`, `assets/`, `scripts/`, and `references/`. Reference files remain at the reference root or in the supported contracts, schemas, and templates collections. Multi-skill executable sources remain under `skills/sections/scripts`, separate from repository-maintenance scripts."
    },
    {
      "id": "skill.runtime_payload_portability",
      "category": "runtime",
      "deterministic_evidence": [
        "skills/skill-sections.json runtime_payloads",
        "declared payload source and target paths",
        "source skills/sections/python/pyproject.toml and uv.lock",
        "installed runtime manifest python_runtime paths",
        "versioned shared skill Python environment behavior tests"
      ],